{
  "eventId": "evt_01",
  "eventType": "grant.issued",
  "timestamp": "2026-09-22T10:00:00Z",
  "namespace": "https://id.example.com/org/acme",
  "agentId": "agt_01JABCDEF0000000000000000",
  "agentEpoch": 4, "identityEpoch": 4,
  "action": "orders.read",
  "resourceDigest": "sha256:abcd",
  "policyVersion": "3",
  "grantId": "grt_01",
  "traceId": "tr_01",
  "outcome": "success",
  "reasonCode": "ok",
  "evidenceRefs": ["ev_01"]
}
